{
  "v": 2,
  "id": "01JB2Z8Y3K4M5N6P7Q8R9S0TVW",
  "type": "files.list.result",
  "ts": 1761274800000,
  "replyTo": "01JB2Z8Y3K4M5N6P7Q8R9S0TVX",
  "payload": {
    "status": "ok",
    "data": {
      "path": "plugins/UltiChat",
      "entries": [
        {
          "name": "config.yml",
          "type": "file",
          "sizeBytes": 1200,
          "modifiedAt": 1761274800000
        },
        {
          "name": "lang",
          "type": "dir",
          "sizeBytes": null,
          "modifiedAt": null
        }
      ],
      "truncated": false
    }
  }
}
